{
  "metadata": {
    "mode": "standard",
    "models": [
      "kimi-k3",
      "dsv4pro",
      "glm53",
      "gemini38flash",
      "gemini31pro"
    ],
    "timestamp": "2026-09-17 17:00:41"
  },
  "stats": {
    "consensus_count": 0,
    "singleton_count": 40,
    "contradiction_count": 1,
    "total_issues": 41
  },
  "consensus": [],
  "contradictions": [
    {
      "issue_id": "I37",
      "target": "orchestrate_v2.py",
      "raised_by": [
        "gemini31pro",
        "gemini38flash"
      ],
      "severity": "P0",
      "claims": [
        {
          "model": "gemini38flash",
          "claim": "cluster_issues 仅依据条目数量而非独立模型数量判断共识，导致单一模型针对同一目标提出的多项发现被错误升级为五人全员高度共识。",
          "evidence": [
            "orchestrate_v2.py:311,325 中使用 len(items) == 1 判断单例，else 分支未校验 len({x['model'] for x in items}) > 1",
            "stop-process-20260917/consensus-report.md:18-23 中由 gemini31pro 单独提出的 I14 approval_detection.py 被归入 Verified Consensus"
          ]
        },
        {
          "model": "gemini38flash",
          "claim": "冲突判定依赖 kind 差异与中文否定字符匹配，导致正常的互补分类和客观技术描述被大面积误判为对立矛盾并粗暴合并为超大议题包。",
          "evidence": [
            "orchestrate_v2.py:328-331 使用 len(kinds) > 1 or any('不' in claim or '错' in claim) 作为矛盾判定标准",
            "stop-process-20260917/challenge-plan.json:1-210 将 28 个不同模型的发现全部打包为单一矛盾议题 C01"
          ]
        },
        {
          "model": "gemini38flash",
          "claim": "矛盾质询计划直接选取 raised[0] 作为审查者，导致编排器要求提案模型审查包含其自身原话的议题包，破坏了交叉审查的独立性。",
          "evidence": [
            "orchestrate_v2.py:420-421 中 reviewer = raised[0] if len(raised) > 0 else model_keys[0]",
            "stop-process-20260917/challenge-plan.json:7 中 C01 由 gemini38flash 审查，但议题包内第 21 个提案即为其自身意见"
          ]
        },
        {
          "model": "gemini38flash",
          "claim": "合议解析采用互斥的 if-elif 结构匹配全文关键字，导致同时包含吸收、驳回与未决的复合质询答复中，后面的 REFUTED 和 UNRESOLVED 表态被完全吞噬。",
          "evidence": [
            "orchestrate_v2.py:588-595 中 if 'CONCEDE' ... elif 'REFUTED' ... elif 'UNRESOLVED' 互斥执行",
            "stop-process-20260917/challenge-reply-C01-gemini38flash.md:43-53 明确包含三类表态，但 consensus-report.md:7-9 显示 Refuted 为 0 项"
          ]
        },
        {
          "model": "gemini38flash",
          "claim": "少数派证据保护逻辑未检查单例在质询阶段的驳回状态，导致已被确凿证据证伪的错误观点依然无条件进入最终未决账本。",
          "evidence": [
            "orchestrate_v2.py:598-609 无条件将所有带 evidence 的 P0/P1 单例加入账本，未过滤 refuted_items",
            "stop-process-20260917/unresolved-ledger.json:9-11 中仅包含无行号文件名 AGENTS.md 的条目被无条件保护"
          ]
        },
        {
          "model": "gemini38flash",
          "claim": "normalize_target 缺失绝对路径向相对路径的转换对齐，导致不同模型针对同一代码文件的发现被切分为不同目标并产生聚类分裂。",
          "evidence": [
            "orchestrate_v2.py:219 仅执行 strip、replace 与行号正则截断",
            "stop-process-20260917/consensus-report.md:18 中绝对路径成为独立 target I14，与相对路径 I01 割裂"
          ]
        },
        {
          "model": "gemini31pro",
          "claim": "cluster_issues 聚类逻辑未能对模型身份去重，单模型在同一目标的多条发现被误判为跨模型共识。",
          "evidence": [
            "issue-registry.json 确凿记录了 I12（仅由 gemini38flash 提出）和 I14（仅由 gemini31pro 提出）被错误归入 consensus 分组。"
          ]
        },
        {
          "model": "gemini31pro",
          "claim": "少数派证据保护逻辑未过滤已证伪项，被成功反驳的高危单例仍会被强制保留。",
          "evidence": [
            "stage_synthesize_v2 函数在遍历 registry.get(\"singletons\", []) 时，直接判断 severity 和 evidence 附加到未决账本，缺乏针对 refuted_items 的拦截排查。"
          ]
        },
        {
          "model": "gemini31pro",
          "claim": "is_conflict 冲突判定规则易造成假阳性误判，包含“错”字的共识表述会被错误标记为矛盾。",
          "evidence": [
            "代码使用 any(\"不\" in ... or \"错\" in ...) 会无差别匹配“代码写错了”等指出缺陷的肯定性共识断言。"
          ]
        },
        {
          "model": "gemini31pro",
          "claim": "normalize_target 未统一绝对与相对路径，导致同文件目标被拆分为多个独立议题。",
          "evidence": [
            "issue-registry.json 中 I14 (绝对路径) 与 I01 (相对路径) 指向同一 approval_detection.py 文件，却在图中形成了两个独立的顶点。"
          ]
        },
        {
          "model": "gemini31pro",
          "claim": "wait_for_outputs 缺乏局部容错机制，任一子进程缺失产出会导致后续链路全盘中断。",
          "evidence": [
            "当 procs_ok and not files_ok 成立时直接 return False，无视其余正常完成的审查结果。"
          ]
        }
      ],
      "state": "contradiction"
    }
  ],
  "singletons": [
    {
      "issue_id": "I01",
      "target": "orchestrate_v2.py:310-345 (cluster_issues)",
      "raised_by": [
        "kimi-k3"
      ],
      "severity": "P0",
      "claim": "聚类按 findings 条数而非去重模型数判定多模型状态,同一模型对同一 target 的多条 findings 被错误标为 consensus 或 contradiction,最终报告将单模型观点呈现为“高度共识项 (Verified Consensus)”。",
      "evidence": [
        "orchestrate_v2.py:311 len(items)==1 与第 325 行注释“2 个及以上模型命中同一 target”不符",
        "issue-registry.json I12/I14(state=consensus,raised_by 单模型),I06/I08/I16(state=contradiction,raised_by 单模型)",
        "consensus-report.md:13-22 I12、I14 列入“高度共识项”且提出方各仅一个模型",
        "探针复现:单模型双 findings 同 target -> [('a.py', ['m1'], 'consensus')]"
      ],
      "blocking": true,
      "state": "singleton"
    },
    {
      "issue_id": "I02",
      "target": "orchestrate_v2.py:326-332 (contradiction 判定)",
      "raised_by": [
        "kimi-k3"
      ],
      "severity": "P0",
      "claim": "矛盾启发式(kinds 不同或 claim 含“不/错”字)把语义一致的意见标为对立,生产 run 的 8 条 contradictions 无一条是断言级对立;伪矛盾占满 max_challenges=3 配额,导致 P0 高危单例 I05 未获质询。",
      "evidence": [
        "orchestrate_v2.py:328-331 is_conflict 实现",
        "issue-registry.json I01 五模型同向确认 Windows 规则缺口仍标 contradiction;I02/I04 同理",
        "challenge-plan.json C01-C03 全部为 contradiction 类型,singleton_audit 轮空",
        "challenge-reply-C01-gemini38flash.md:19-26 真正分歧存在于子断言级(kill -9 -1 层级归属),target 级聚类不可见"
      ],
      "blocking": true,
      "state": "singleton"
    },
    {
      "issue_id": "I03",
      "target": "orchestrate_v2.py:215-222 (normalize_target) 与 192 (fallback 正则)",
      "raised_by": [
        "kimi-k3"
      ],
      "severity": "P1",
      "claim": "目标归一化不做路径等价归一且 fallback 正则不匹配盘符冒号,同一文件裂变为多个 target,正则片段被误认为文件路径,产生幽灵 target 并撕裂真共识。",
      "evidence": [
        "探针:normalize_target('cli\\\\.py') -> 'cli/.py'",
        "issue-registry.json:approval_detection.py 裂为 3 个 target(I01/I13/I14),test_approval_windows.py 3 个,scan_history.py 与 approval.py 各 2 个;16 issue 按 basename 归并仅 10 个真实文件",
        "unresolved-ledger.json 与 consensus-report.md:32-36 幽灵路径 cli/.py 以 P0 入账并入报告"
      ],
      "blocking": true,
      "state": "singleton"
    },
    {
      "issue_id": "I04",
      "target": "orchestrate_v2.py:186-212 (extract_findings_json 启发式兜底) 与 158-164",
      "raised_by": [
        "kimi-k3"
      ],
      "severity": "P1",
      "claim": "结构化 findings 层在生产中 100% 由正则启发式合成(该 run 的 prompt 与 task.md 均未要求结构化产出,五模型无一补写),兜底把流程说明与规则引用行抓成 finding;兜底落盘的 sidecar 与模型亲笔 JSON 无来源区分。",
      "evidence": [
        "stop-process-20260917/prompt-kimi-k3.txt 全文 11 行为 v1 PLAN_PROMPT,无 findings/JSON 字样;task.md 检索同样为零",
        "review-*.md 检索 findings/severity/代码围栏零命中",
        "五份 findings-*.json 呈现同一兜底签名:kind 仅 bug/observation、claim 第 140 字符硬截断(如 'fork bom'、'定向 PI')、evidence 单定位符、unknowns/assumptions 全空",
        "findings-kimi-k3.json F1“材料范围……”流程说明成为 P2 finding 并混入 C01 bundle Proposal-1;findings-gemini38flash.json F9 规则引用行成为 P0",
        "orchestrate_v2.py:180-181、210-211 兜底落盘无任何 provenance 标记"
      ],
      "blocking": true,
      "state": "singleton"
    },
    {
      "issue_id": "I05",
      "target": "orchestrate_v2.py:419-421 (质询者选取) 与 challenge bundle 生成",
      "raised_by": [
        "kimi-k3"
      ],
      "severity": "P1",
      "claim": "匿名质询不匿名:质询者恒为争议当事人(注释承诺的回避逻辑未实现且 raised[0] 依赖不稳定的集合序),bundle 提案顺序与 models 阵容顺序逐项对齐可直接解码作者,claim 保留第一人称叙事指纹。",
      "evidence": [
        "challenge-plan.json:C01/C02/C03 reviewer 均在各自 issue raised_by 内(self_review=True)",
        "challenge-reply-C01-gemini38flash.md:13“已在我方独立评审中完成覆盖”——质询者认出自己文字",
        "C01 bundle 28 提案按 kimi-k3×9、dsv4pro×6、glm53×6、gemini38flash×4、gemini31pro×3 排列,与 MODE_PRESETS standard models 顺序一致",
        "探针:四种 PYTHONHASHSEED 下 list(raised_set)[0] 出现三种取值"
      ],
      "blocking": false,
      "state": "singleton"
    },
    {
      "issue_id": "I06",
      "target": "orchestrate_v2.py:589-594 (表态解析 elif 链)",
      "raised_by": [
        "kimi-k3"
      ],
      "severity": "P1",
      "claim": "表态按文件级单标签 elif 归类,与提示词要求的逐断言表态粒度错配;生产 run 中含 CONCEDE+REFUTED+UNRESOLVED 三种表态的答复只被记为 Conceded,最有价值的 REFUTED 纠偏与 UNRESOLVED 项在报告与账本中消失。",
      "evidence": [
        "challenge-reply-C01-gemini38flash.md:43/48/52 三种表态并存",
        "consensus-report.md:7-8 Conceded: 1、Refuted: 0;ledger 仅含两条单例保护项",
        "orchestrate_v2.py:589 'CONCEDE' in text 子串匹配,“我方不 CONCEDE”亦命中"
      ],
      "blocking": true,
      "state": "singleton"
    },
    {
      "issue_id": "I07",
      "target": "orchestrate_v2.py:596-608 (少数派证据保护)",
      "raised_by": [
        "kimi-k3"
      ],
      "severity": "P1",
      "claim": "保护实现与注释承诺不符:注释限定“未被质询直接证伪”,实现无条件收录全部带非空 evidence 的 P0/P1 单例,无证据质量门槛,亦不检查质询驳回结果;幽灵路径因此获得机制背书。",
      "evidence": [
        "orchestrate_v2.py:596-597 注释 vs 598-608 无条件 append",
        "unresolved-ledger.json I11 cli/.py P0(fallback 噪声)被保护入账",
        "consensus-report.md:32-36 同一幽灵项呈现于终报"
      ],
      "blocking": false,
      "state": "singleton"
    },
    {
      "issue_id": "I08",
      "target": "skill.md:60-62 与 orchestrate_v2.py:46-63、472-492 (三档模式拓扑)",
      "raised_by": [
        "kimi-k3"
      ],
      "severity": "P1",
      "claim": "文档声明的调用次数与代码拓扑不符:standard 实为 5-8 次(文档 7-8),audit 实为 5-10 次(文档 10-12),错排匹配与矛盾、单例质询共享 max_challenges=5 配额而非文档暗示的叠加;“压降 60%+”无测量对应物。",
      "evidence": [
        "探针按 MODE_PRESETS 推算:economy 3-4、standard 5-8、audit 5-10",
        "SKILL.md:60-62 次数声明原文",
        "orchestrate_v2.py:472-492 derangement 仅在 len(challenges)<max_challenges 时补充,共用配额"
      ],
      "blocking": false,
      "state": "singleton"
    },
    {
      "issue_id": "I09",
      "target": "orchestrate_v2.py:614-645 (stage_synthesize_v2 报告生成)",
      "raised_by": [
        "kimi-k3"
      ],
      "severity": "P1",